{
  "schema_version": "1.0.0",
  "model_id": "cmz-client-landing-home-list-query-semantic",
  "domain": {
    "id": "cmz-client-landing-home",
    "name": "CMZ Client — Landing home blocks",
    "description": "Blocs de contenu éditorial actifs affichés sur la page d'accueil publique du client CMZ."
  },
  "types": [
    {
      "id": "list-query-no-input",
      "kind": "opaque",
      "description": "Marker type: this operation takes no input.",
      "fields": [],
      "evidence_refs": ["fact.cmz-client-landing-home.no-input"]
    },
    {
      "id": "home-block-info",
      "kind": "object",
      "description": "Un bloc de contenu éditorial de la page d'accueil.",
      "fields": [
        {
          "name": "id",
          "type": {
            "kind": "primitive",
            "name": "integer",
            "nullable": false
          },
          "required": true,
          "evidence_refs": ["fact.list-home-block-infos.item"]
        },
        {
          "name": "title",
          "type": {
            "kind": "primitive",
            "name": "string",
            "nullable": false
          },
          "required": true,
          "evidence_refs": ["fact.list-home-block-infos.item"]
        },
        {
          "name": "slug",
          "type": {
            "kind": "primitive",
            "name": "string",
            "nullable": false
          },
          "required": true,
          "evidence_refs": ["fact.list-home-block-infos.item"]
        },
        {
          "name": "resume",
          "type": {
            "kind": "primitive",
            "name": "string",
            "nullable": true
          },
          "required": true,
          "evidence_refs": ["fact.list-home-block-infos.item"]
        },
        {
          "name": "content",
          "type": {
            "kind": "primitive",
            "name": "string",
            "nullable": false
          },
          "required": true,
          "evidence_refs": ["fact.list-home-block-infos.item"]
        },
        {
          "name": "type",
          "type": {
            "kind": "primitive",
            "name": "string",
            "nullable": false
          },
          "required": true,
          "evidence_refs": ["fact.list-home-block-infos.item"]
        },
        {
          "name": "image_url",
          "type": {
            "kind": "primitive",
            "name": "string",
            "nullable": true
          },
          "required": true,
          "evidence_refs": ["fact.list-home-block-infos.item"]
        },
        {
          "name": "video_url",
          "type": {
            "kind": "primitive",
            "name": "string",
            "nullable": true
          },
          "required": true,
          "evidence_refs": ["fact.list-home-block-infos.item"]
        },
        {
          "name": "button_label",
          "type": {
            "kind": "primitive",
            "name": "string",
            "nullable": true
          },
          "required": true,
          "evidence_refs": ["fact.list-home-block-infos.item"]
        },
        {
          "name": "button_url",
          "type": {
            "kind": "primitive",
            "name": "string",
            "nullable": true
          },
          "required": true,
          "evidence_refs": ["fact.list-home-block-infos.item"]
        },
        {
          "name": "updated_at",
          "type": {
            "kind": "primitive",
            "name": "string",
            "nullable": false
          },
          "required": true,
          "evidence_refs": ["fact.list-home-block-infos.item"]
        }
      ],
      "evidence_refs": ["fact.list-home-block-infos.item"]
    }
  ],
  "operations": [
    {
      "id": "list-home-block-infos",
      "kind": "query",
      "description": "Récupère les blocs de contenu actifs pour la page d'accueil.",
      "input": {
        "kind": "model",
        "name": "list-query-no-input",
        "nullable": false
      },
      "output": {
        "kind": "list",
        "nullable": false,
        "items": {
          "kind": "model",
          "name": "home-block-info",
          "nullable": false
        }
      },
      "access": {
        "mode": "public",
        "evidence_refs": ["fact.list-home-block-infos.operation"]
      },
      "effects": [
        {
          "kind": "external_call",
          "description": "Fetches home-block-info entries from the backend.",
          "evidence_refs": ["fact.list-home-block-infos.operation"]
        }
      ],
      "integration_ref": "integration.list-home-block-infos",
      "evidence_refs": [
        "fact.list-home-block-infos.operation",
        "fact.list-home-block-infos.item"
      ]
    }
  ],
  "constraints": [],
  "integrations": [
    {
      "id": "integration.list-home-block-infos",
      "kind": "http",
      "method": "GET",
      "path": "cms/home-block-infos/actives/pwa",
      "authentication": "none",
      "response_envelope": "simple",
      "evidence_refs": ["fact.list-home-block-infos.operation"]
    }
  ]
}
